ticker,text,original,preditions,predictions_score,hand_labeled
VRSN,"verisign, inc., together with its subsidiaries, provides domain name registry services and internet infrastructure that enables internet navigation for various recognized domain names worldwide. it enables the security, stability, and resiliency of internet infrastructure and services, including providing root zone maintainer services, operating two of the 13 internet root servers; and offering registration services and authoritative resolution for the .com and .net domains, which support global e-commerce. the company also back-end systems for .cc, .gov, .edu, and .name domain names, as well as operates distributed servers, networking, security, and data integrity services. verisign, inc. was incorporated in 1995 and is headquartered in reston, virginia.",['Software & Services'],"['Media & Entertainment', 'Software & Services', 'Telecommunication Services', 'Pharmaceuticals, Biotechnology & Life Sciences', 'Commercial & Professional Services']",[0.36582139 0.11642299 0.08986045 0.01974864 0.00463563],
WU,"the western union company provides money movement and payment services worldwide. the company operates in two segments, consumer-to-consumer and business solutions. the consumer-to-consumer segment facilitates money transfers between two consumers, primarily through a network of third-party agents and sub-agents; and offers international cross-border transfers and intra-country transfers, as well as money transfer transactions through websites and mobile devices. the business solutions segment provides payment and foreign exchange solutions, primarily cross-border and cross-currency transactions for small and medium size enterprises, other organizations, and individuals; and foreign currency forward and option contracts. it also offers bill payment services that facilitates payments from consumers to businesses and other organizations, as well as offers money order and other services. the company was founded in 1851 and is headquartered in denver, colorado.",['Software & Services'],"['Technology Hardware & Equipment', 'Software & Services', 'Telecommunication Services', 'Commercial & Professional Services', 'Semiconductors & Semiconductor Equipment']",[0.81582868 0.25418034 0.04359422 0.02371277 0.00353942],
AAPL,"apple inc. designs, manufactures, and markets smartphones, personal computers, tablets, wearables, and accessories worldwide. it also sells various related services. in addition, the company offers iphone, a line of smartphones; mac, a line of personal computers; ipad, a line of multi-purpose tablets; and wearables, home, and accessories comprising airpods, apple tv, apple watch, beats products, and homepod. further, it provides applecare support and cloud services store services; and operates various platforms, including the app store that allow customers to discover and download applications and digital content, such as books, music, video, games, and podcasts. additionally, the company offers various services, such as apple arcade, a game subscription service; apple fitness+, a personalized fitness service; apple music, which offers users a curated listening experience with on-demand radio stations; apple news+, a subscription news and magazine service; apple tv+, which offers exclusive original content; apple card, a co-branded credit card; and apple pay, a cashless payment service, as well as licenses its intellectual property. the company serves consumers, and small and mid-sized businesses; and the education, enterprise, and government markets. it distributes third-party applications for its products through the app store. the company also sells its products through its retail and online stores, and direct sales force; and third-party cellular network carriers, wholesalers, retailers, and resellers. apple inc. was incorporated in 1977 and is headquartered in cupertino, california.",['Technology Hardware & Equipment'],"['Technology Hardware & Equipment', 'Semiconductors & Semiconductor Equipment', 'Commercial & Professional Services', 'Software & Services', 'Health Care Equipment & Services']",[0.88588059 0.03396275 0.01135118 0.01008411 0.00958132],"['Technology Hardware & Equipment', 'Commercial & Professional Services', 'Software & Services']"
ANET,"arista networks, inc. develops, markets, and sells cloud networking solutions in the americas, europe, the middle east, africa, and the asia-pacific. the company's cloud networking solutions consist of extensible operating systems, a set of network applications, as well as gigabit ethernet switching and routing platforms. it also provides post contract customer support services, such as technical support, hardware repair and parts replacement beyond standard warranty, bug fix, patch, and upgrade services. the company serves a range of industries comprising internet companies, service providers, financial services organizations, government agencies, media and entertainment companies, and others. it markets and sells its products through distributors, system integrators, value-added resellers, and original equipment manufacturer partners, as well as through its direct sales force. the company was formerly known as arastra, inc. and changed its name to arista networks, inc. in october 2008. arista networks, inc. was incorporated in 2004 and is headquartered in santa clara, california.",['Technology Hardware & Equipment'],"['Technology Hardware & Equipment', 'Capital Goods', 'Semiconductors & Semiconductor Equipment', 'Telecommunication Services', 'Software & Services']","[9.80958402e-01 5.22470325e-02 2.34978180e-03 1.31969561e-03
 5.73092766e-05]","['Technology Hardware & Equipment', 'Software & Services']"
APH,"amphenol corporation, together with its subsidiaries, primarily designs, manufactures, and markets electrical, electronic, and fiber optic connectors in the united states, china, and internationally. it operates through three segments: harsh environment solutions, communications solutions, and interconnect and sensor systems. the company offers connectors and connector systems, including harsh environment data, power, high-speed, fiber optic, and radio frequency interconnect products; busbars and power distribution systems; and other connectors. it also provides value-add products, such as backplane interconnect systems, cable assemblies and harnesses, and cable management products; other products comprising flexible and rigid printed circuit boards, hinges, other mechanical, and production related products. in addition, the company offers consumer device, network infrastructure, and other antennas; coaxial, power, and specialty cables; and sensors and sensor-based products. it sells its products through its sales force, independent representatives, and a network of electronics distributors to original equipment manufacturers, electronic manufacturing services companies, original design manufacturers, and service providers in the automotive, broadband communication, commercial aerospace, industrial, information technology and data communication, military, mobile device, and mobile network markets. amphenol corporation was founded in 1932 and is headquartered in wallingford, connecticut.",['Technology Hardware & Equipment'],"['Capital Goods', 'Consumer Durables & Apparel', 'Technology Hardware & Equipment', 'Semiconductors & Semiconductor Equipment', 'Automobiles & Components']","[5.26589990e-01 1.37784347e-01 7.73176923e-03 2.08072073e-04
 9.36408196e-06]",['Technology Hardware & Equipment']
CDW,"cdw corporation provides information technology (it) solutions in the united states, the united kingdom, and canada. it operates through three segments: corporate, small business, and public. the company offers discrete hardware and software products and services, as well as integrated it solutions, including on-premise, hybrid, and cloud capabilities across data center and networking, digital workspace, and security. its hardware products comprise notebooks/mobile devices, network communications, desktop computers, video monitors, enterprise and data storage, and others; and software products consists of application suites, security, virtualization, operating systems, and network management. the company also provides advisory and design, software development, implementation, managed, professional, configuration, and telecom services, as well as warranties; mission critical software, systems, and network solutions; and implementation and installation, and repair services to its customers through various third-party service providers. it serves government, education, and healthcare customers; and small, medium, and large business customers. the company was founded in 1984 and is headquartered in vernon hills, illinois.",['Technology Hardware & Equipment'],"['Technology Hardware & Equipment', 'Capital Goods', 'Software & Services', 'Commercial & Professional Services', 'Semiconductors & Semiconductor Equipment']",[0.88122034 0.07492515 0.00670556 0.00489707 0.00328081],"['Technology Hardware & Equipment', 'Software & Services']"
CSCO,"cisco systems, inc. designs, manufactures, and sells internet protocol based networking and other products related to the communications and information technology industry in the americas, europe, the middle east, africa, the asia pacific, japan, and china. the company also offers switching portfolio encompasses campus switching as well as data center switching; enterprise routing portfolio interconnects public and private wireline and mobile networks, delivering highly secure, and reliable connectivity to campus, data center and branch networks; wireless products include wireless access points that are standalone, controller appliance-based, switch-converged, and meraki cloud-managed offerings; and compute portfolio including the cisco unified computing system, hyperflex, and software management capabilities, which combine computing, networking, and storage infrastructure management and virtualization. in addition, it provides internet for the future product consists of routed optical networking, 5g, silicon, and optics solutions; collaboration products, such as meetings, collaboration devices, calling, contact center, and communication platform as a service; end-to-end security product consists of network security, cloud security, security endpoints, unified threat management, and zero trust; and optimized application experiences products including full stack observability and cloud-native platform. further, the company offers a range of service and support options for its customers, including technical support and advanced services and advisory services. it serves businesses of various sizes, public institutions, governments, and service providers. the company sells its products and services directly, as well as through systems integrators, service providers, other resellers, and distributors. cisco systems, inc. has strategic alliances with other companies. cisco systems, inc. was incorporated in 1984 and is headquartered in san jose, california.",['Technology Hardware & Equipment'],"['Technology Hardware & Equipment', 'Semiconductors & Semiconductor Equipment', 'Telecommunication Services', 'Capital Goods', 'Software & Services']","[9.06898916e-01 5.71947470e-02 1.12603935e-04 9.38926241e-05
 3.68279325e-05]","['Technology Hardware & Equipment', 'Commercial & Professional Services', 'Software & Services']"
FFIV,"f5, inc. provides multi-cloud application security and delivery solutions for the security, performance, and availability of network applications, servers, and storage systems. the company's multi-cloud application security and delivery solutions enable its customers to develop, deploy, operate, secure, and govern applications in any architecture, from on-premises to the public cloud. it offers application security and delivery products, including big-ip appliances and viprion chassis and related software modules and software-only virtual editions; local traffic manager and dns services; advanced firewall manager and policy enforcement manager that leverage the unique performance characteristics of its hardware and software architecture; application security manager and access policy manager; nginx plus and nginx controller; shape defense and enterprise defense; secure web gateway, and silverline ddos and application security offerings; and online fraud and abuse prevention solutions. the company also provides a range of professional services, including consulting, training, installation, maintenance, and other technical support services. f5, inc. sells its products to large enterprise businesses, public sector institutions, governments, and service providers through distributors, value-added resellers, managed service providers, and systems integrators in the americas, europe, the middle east, africa, and the asia pacific region. it has partnerships with public cloud providers, such as amazon web services, microsoft azure, and google cloud platform. the company was formerly known as f5 networks, inc. and changed its name to f5, inc. in november 2021. f5, inc. was incorporated in 1996 and is headquartered in seattle, washington.",['Technology Hardware & Equipment'],"['Software & Services', 'Technology Hardware & Equipment', 'Telecommunication Services', 'Retailing', 'Commercial & Professional Services']",[0.94636065 0.0688099  0.00718284 0.00358309 0.00179056],"['Technology Hardware & Equipment', 'Commercial & Professional Services']"
GLW,"corning incorporated engages in display technologies, optical communications, environmental technologies, specialty materials, and life sciences businesses worldwide. the company's display technologies segment offers glass substrates for liquid crystal displays and organic light-emitting diodes used in televisions, notebook computers, desktop monitors, tablets, and handheld devices. its optical communications segment provides optical fibers and cables; and hardware and equipment products, including cable assemblies, fiber optic hardware and connectors, optical components and couplers, closures, network interface devices, and other accessories. this segment also offers its products to businesses, governments, and individuals. its specialty materials segment manufactures products that provide material formulations for glass, glass ceramics, crystals, precision metrology instruments, software; as well as ultra-thin and ultra-flat glass wafers, substrates, tinted sunglasses, and radiation shielding products. this segment serves various industries, including mobile consumer electronics, semiconductor equipment optics and consumables; aerospace and defense optics; radiation shielding products, sunglasses, and telecommunications components. the company's environmental technologies segment offers ceramic substrates and filter products for emissions control in mobile, gasoline, and diesel applications. the company's life sciences segment offers laboratory products comprising consumables, such as plastic vessels, liquid handling plastics, specialty surfaces, cell culture media, and serum, as well as general labware and equipment under the corning, falcon, pyrex, and axygen brands. the company was formerly known as corning glass works and changed its name to corning incorporated in april 1989. corning incorporated was founded in 1851 and is headquartered in corning, new york.",['Technology Hardware & Equipment'],"['Technology Hardware & Equipment', 'Health Care Equipment & Services', 'Capital Goods', 'Semiconductors & Semiconductor Equipment', 'Consumer Durables & Apparel']",[0.6533137  0.02572766 0.02117222 0.01607346 0.00310883],"['Technology Hardware & Equipment', 'Health Care Equipment & Services']"
HPE,"hewlett packard enterprise company provides solutions that allow customers to capture, analyze, and act upon data seamlessly in the americas, europe, the middle east, africa, the asia pacific, and japan. the company offers general purpose servers for multi-workload computing and workload-optimized servers; hpe proliant rack and tower servers; hpe bladesystem and hpe synergy; and solutions for secondary workloads and traditional tape, storage networking, and disk products, such as hpe modular storage arrays and hpe xp. it also offers hpe apollo and cray products; and hpe superdome flex, hpe nonstop, hpe integrity, and hpe edgeline products. in addition, the company provides hpe aruba product portfolio that includes wired and wireless local area network hardware products, such as wi-fi access points, switches, routers, and sensors; hpe aruba software and services comprising cloud-based management, network management, network access control, analytics and assurance, and location; and professional and support services, as well as as-a-service and consumption models for the intelligent edge portfolio of products. further, it offers various leasing, financing, it consumption, and utility programs and asset management services for customers to facilitate technology deployment models and the acquisition of complete it solutions, including hardware, software, and services from hewlett packard enterprise and others. additionally, the company invests in communications and media solutions. it has a partnership with striim, inc. to offer high performance and mission-critical solutions with real-time analytics. it serves commercial and large enterprise groups, such as business and public sector enterprises; and through various partners comprising resellers, distribution partners, original equipment manufacturers, independent software vendors, systems integrators, and advisory firms. hewlett packard enterprise company was founded in 1939 and is headquartered in houston, texas.",['Technology Hardware & Equipment'],"['Technology Hardware & Equipment', 'Capital Goods', 'Semiconductors & Semiconductor Equipment', 'Health Care Equipment & Services', 'Software & Services']",[0.35384083 0.13578208 0.01130014 0.00193891 0.00072238],"['Technology Hardware & Equipment', 'Commercial & Professional Services']"
HPQ,"hp inc. provides personal computing and other access devices, imaging and printing products, and related technologies, solutions, and services in the united states and internationally. the company operates through three segments: personal systems, printing, and corporate investments. the personal systems segment offers commercial and consumer desktop and notebook personal computers, workstations, thin clients, commercial mobility devices, retail point-of-sale systems, displays and peripherals, software, support, and services. the printing segment provides consumer and commercial printer hardware, supplies, solutions, and services. the corporate investments segment is involved in the hp labs and business incubation, and investment projects. it serves individual consumers, small- and medium-sized businesses, and large enterprises, including customers in the government, health, and education sectors. the company was formerly known as hewlett-packard company and changed its name to hp inc. in october 2015. hp inc. was founded in 1939 and is headquartered in palo alto, california.",['Technology Hardware & Equipment'],"['Capital Goods', 'Materials', 'Health Care Equipment & Services', 'Technology Hardware & Equipment', 'Commercial & Professional Services']",[0.51450139 0.29466522 0.18692182 0.00494399 0.00168071],
IPGP,"ipg photonics corporation develops, manufactures, and sells various high-performance fiber lasers, fiber amplifiers, and diode lasers used in various applications primarily in materials processing worldwide. the company's laser products include hybrid fiber-solid state lasers with green and ultraviolet wavelengths; fiber pigtailed packaged diodes and fiber coupled direct diode laser systems; high-energy pulsed lasers, multi-wavelength and tunable lasers, and single-polarization and single-frequency lasers; and high-power optical fiber delivery cables, fiber couplers, beam switches, chillers, scanners, and other accessories. it also provides erbium-doped fiber and raman amplifiers, and integrated communications systems, which are deployed in broadband networks; and ytterbium and thulium specialty fiber amplifiers and broadband light sources. in addition, the company offers integrated laser systems; 2d compact flat sheet cutter systems and multi-axis systems; welding seam stepper and picker, a fiber laser welding tool; high precision laser systems; specialized fiber laser systems; and optical transceiver and transponder modules for interconnecting electronic equipment, including ethernet switches, ip routers and dwdm/sonet/sdh optical transport modules within telecommunications, cable multi-system operators, and data center networking applications. it's lasers and amplifiers are also used in materials processing, communications, and medical and advanced applications. the company markets its products to original equipment manufacturers, system integrators, and end users through direct sales force, as well as through agreements with independent sales representatives and distributors. ipg photonics corporation was founded in 1990 and is headquartered in oxford, massachusetts.",['Technology Hardware & Equipment'],"['Semiconductors & Semiconductor Equipment', 'Technology Hardware & Equipment', 'Health Care Equipment & Services', 'Pharmaceuticals, Biotechnology & Life Sciences', 'Materials']","[8.53552818e-01 1.34740537e-02 7.21136224e-04 1.46621569e-05
 3.65291839e-06]",['Technology Hardware & Equipment']
JNPR,"juniper networks, inc. designs, develops, and sells network products and services worldwide. the company offers routing products, such as acx series universal access routers to deploy high-bandwidth services; mx series ethernet routers that function as a universal edge platform; ptx series packet transport routers; wide-area network sdn controllers; and session smart routers. it also provides switching products, including ex series ethernet switches to address the access, aggregation, and core layer switching requirements of micro branch, branch office, and campus environments; qfx series of core, spine, and top-of-rack data center switches; and juniper access points, which provide wi-fi access and performance. in addition, the company offers security products comprising srx series services gateways for the data center; branch srx family provides an integrated and next-generation firewall; virtual firewall that delivers various features of physical firewalls; and advanced malware protection, a cloud-based service and juniper atp. further, it offers junos os, a network operating system; contrail networking, which provides an open-source and standards-based platform for sdn; mist ai-driven wired, wireless, and wan assurance solutions to set and measure key metrics; mist ai-driven marvis virtual network assistant, which identifies the root cause of issues; juniper paragon automation, a modular portfolio of cloud-native software applications; and juniper apstra to automate the network lifecycle in a single system. additionally, the company provides software-as-a-service, technical support, maintenance, and professional services, as well as education and training programs. it sells its products through direct sales, distributors, value-added resellers, and original equipment manufacturers to end-users in the cloud, service provider, and enterprise markets. the company was incorporated in 1996 and is headquartered in sunnyvale, california.",['Technology Hardware & Equipment'],"['Technology Hardware & Equipment', 'Semiconductors & Semiconductor Equipment', 'Software & Services', 'Telecommunication Services', 'Capital Goods']","[6.94559813e-01 8.64161849e-02 2.58434040e-04 3.66829991e-05
 2.53237831e-05]","['Technology Hardware & Equipment', 'Software & Services']"
