ticker,text,original,preditions,predictions_score,hand_labeled
GOOGL,"alphabet inc. provides various products and platforms in the united states, europe, the middle east, africa, the asia-pacific, canada, and latin america. it operates through google services, google cloud, and other bets segments. the google services segment offers products and services, including ads, android, chrome, hardware, gmail, google drive, google maps, google photos, google play, search, and youtube. it is also involved in the sale of apps and in-app purchases and digital content in the google play store; and fitbit wearable devices, google nest home products, pixel phones, and other devices, as well as in the provision of youtube non-advertising services. the google cloud segment offers infrastructure, platform, and other services; google workspace that include cloud-based collaboration tools for enterprises, such as gmail, docs, drive, calendar, and meet; and other services for enterprise customers. the other bets segment sells health technology and internet services. the company was founded in 1998 and is headquartered in mountain view, california.",['Media & Entertainment'],"['Media & Entertainment', 'Retailing', 'Pharmaceuticals, Biotechnology & Life Sciences', 'Health Care Equipment & Services', 'Technology Hardware & Equipment']",[0.72279829 0.46084568 0.0530658  0.03818487 0.01076021],"['Media & Entertainment',  'Health Care Equipment & Services','Technology Hardware & Equipment', 'Telecommunication Services','Software & Services']"
IPG,"the interpublic group of companies, inc. provides advertising and marketing services worldwide. it operates in two segments, integrated agency networks (ian) and ipg dxtra. the company offers consumer advertising, digital marketing, communications planning and media buying, public relations, and specialized communications disciplines, as well as data science services. it also provides various diversified services, including meeting and event production, sports and entertainment marketing, corporate and brand identity, and strategic marketing consulting. the company was formerly known as mccann-erickson incorporated and changed its name to the interpublic group of companies, inc. in january 1961. the interpublic group of companies, inc. was founded in 1902 and is headquartered in new york, new york.",['Media & Entertainment'],"['Media & Entertainment', 'Telecommunication Services', 'Consumer Durables & Apparel', 'Technology Hardware & Equipment', 'Pharmaceuticals, Biotechnology & Life Sciences']","[9.62940156e-01 1.22812381e-02 7.57400878e-04 3.19881132e-04
 2.31217273e-04]",
LYV,"live nation entertainment, inc. operates as a live entertainment company. it operates through concerts, ticketing, and sponsorship & advertising segments. the concerts segment promotes live music events in its owned or operated venues, and in rented third-party venues; operates and manages music venues; produces music festivals; creates associated content; and offers management and other services to artists. the ticketing segment manages the ticketing operations, including the provision of ticketing software and services to clients for tickets and event information through its primary websites livenation.com and ticketmaster.com, as well as provides ticket resale services. this segment sells tickets for its events, as well as for third-party clients in various live event categories, such as arenas, stadiums, amphitheaters, music clubs, concert promoters, professional sports franchises and leagues, college sports teams, performing arts venues, museums, and theaters through websites, mobile apps, and ticket outlets. the sponsorship & advertising segment sells international, national, and local sponsorships and placement of advertising, including signage, promotional programs, rich media offering that comprise advertising related with live streaming and music-related content; and ads across its distribution network of venues, events, and websites. this segment also manages the development of strategic sponsorship programs, as well as develops, books, and produces custom events or programs for specific brands. as of december 31, 2021, it owned, operated, or leased 165 entertainment venues in north america and 94 entertainment venues internationally. the company was formerly known as live nation, inc. and changed its name to live nation entertainment, inc. in january 2010. live nation entertainment, inc. was incorporated in 2005 and is headquartered in beverly hills, california.",['Media & Entertainment'],"['Media & Entertainment', 'Retailing', 'Consumer Durables & Apparel', 'Real Estate', 'Pharmaceuticals, Biotechnology & Life Sciences']","[9.98742402e-01 3.47559266e-02 1.31688383e-03 3.27697984e-04
 2.78493622e-04]",
NFLX,"netflix, inc. provides entertainment services. it offers tv series, documentaries, feature films, and mobile games across various genres and languages. the company provides members the ability to receive streaming content through a host of internet-connected devices, including tvs, digital video players, television set-top boxes, and mobile devices. it also provides dvds-by-mail membership services in the united states. the company has approximately 222 million paid members in 190 countries. netflix, inc. was incorporated in 1997 and is headquartered in los gatos, california.",['Media & Entertainment'],"['Media & Entertainment', 'Retailing', 'Pharmaceuticals, Biotechnology & Life Sciences', 'Technology Hardware & Equipment', 'Consumer Services']","[9.99714196e-01 7.73070846e-03 5.36676683e-03 1.21939660e-03
 3.67672648e-04]",
NWS,"news corporation, a media and information services company, creates and distributes authoritative and engaging content, and other products and services for consumers and businesses worldwide. it operates in six segments: digital real estate services, subscription video services, dow jones, book publishing, news media, and other. the company distributes content and data products, including the wall street journal, barron's, marketwatch, investor's business daily, factiva, dow jones risk & compliance, dow jones newswires, and opis through various media channels, such as newspapers, newswires, websites, mobile apps, newsletters, magazines, proprietary databases, live journalism, video, and podcasts. it also owns and operates daily, sunday, weekly, and bi-weekly newspapers comprising the australian, the weekend australian, the daily telegraph, the sunday telegraph, herald sun, sunday herald sun, the courier mail, the sunday mail, the advertiser, sunday mail, the sun, the sun on sunday, the times, the sunday times, and new york post, as well as digital mastheads and other websites. in addition, the company publishes general fiction, nonfiction, children's, and religious books; provides sports, entertainment, and news services to pay-tv and streaming subscribers, and other commercial licensees through cable, satellite, and internet distribution; and broadcasts rights to live sporting events. further, it offers property and property-related advertising and services on its websites and mobile applications; online real estate services; and financial services. the company was founded in 2012 and is headquartered in new york, new york.",['Media & Entertainment'],"['Media & Entertainment', 'Real Estate', 'Retailing', 'Pharmaceuticals, Biotechnology & Life Sciences', 'Telecommunication Services']",[0.99610871 0.0260013  0.01764689 0.00753416 0.00530249],
NWSA,"news corporation, a media and information services company, creates and distributes authoritative and engaging content, and other products and services for consumers and businesses worldwide. it operates in six segments: digital real estate services, subscription video services, dow jones, book publishing, news media, and other. the company distributes content and data products, including the wall street journal, barron's, marketwatch, investor's business daily, factiva, dow jones risk & compliance, dow jones newswires, and opis through various media channels, such as newspapers, newswires, websites, mobile apps, newsletters, magazines, proprietary databases, live journalism, video, and podcasts. it also owns and operates daily, sunday, weekly, and bi-weekly newspapers comprising the australian, the weekend australian, the daily telegraph, the sunday telegraph, herald sun, sunday herald sun, the courier mail, the sunday mail, the advertiser, sunday mail, the sun, the sun on sunday, the times, the sunday times, and new york post, as well as digital mastheads and other websites. in addition, the company publishes general fiction, nonfiction, children's, and religious books; provides sports, entertainment, and news services to pay-tv and streaming subscribers, and other commercial licensees through cable, satellite, and internet distribution; and broadcasts rights to live sporting events. further, it offers property and property-related advertising and services on its websites and mobile applications; online real estate services; and financial services. the company was founded in 2012 and is headquartered in new york, new york.",['Media & Entertainment'],"['Media & Entertainment', 'Real Estate', 'Retailing', 'Pharmaceuticals, Biotechnology & Life Sciences', 'Telecommunication Services']",[0.99610871 0.0260013  0.01764689 0.00753416 0.00530249],
OMC,"omnicom group inc., together with its subsidiaries, provides advertising, marketing, and corporate communications services. it provides a range of services in the areas of advertising, customer relationship management, public relations, and healthcare. the company's services include advertising, branding, content marketing, corporate social responsibility consulting, crisis communications, custom publishing, data analytics, database management, digital/direct marketing, digital transformation, entertainment marketing, experiential marketing, field marketing, financial/corporate business-to-business advertising, graphic arts/digital imaging, healthcare marketing and communications, and in-store design services. its services also comprise interactive marketing, investor relations, marketing research, media planning and buying, merchandising and point of sale, mobile marketing, multi-cultural marketing, non-profit marketing, organizational communications, package design, product placement, promotional marketing, public affairs, retail marketing, sales support, search engine marketing, shopper marketing, social media marketing, and sports and event marketing services. it operates in the united states, canada, puerto rico, south america, mexico, europe, the middle east, africa, australia, greater china, india, japan, korea, new zealand, singapore, and other asian countries. the company was incorporated in 1944 and is based in new york, new york.",['Media & Entertainment'],"['Media & Entertainment', 'Retailing', 'Consumer Durables & Apparel', 'Pharmaceuticals, Biotechnology & Life Sciences', 'Real Estate']",[0.98222047 0.09537914 0.02902538 0.00382646 0.00287849],
TTWO,"take-two interactive software, inc. develops, publishes, and markets interactive entertainment solutions for consumers worldwide. the company offers its products under the rockstar games, 2k, private division, and t2 mobile games names. it develops and publishes action/adventure products under the grand theft auto, max payne, midnight club, and red dead redemption names; and offers episodes and content, as well as develops brands in other genres, including the la noire, bully, and manhunt franchises. the company also publishes various entertainment properties across various platforms and a range of genres, such as shooter, action, role-playing, strategy, sports, and family/casual entertainment under the bioshock, mafia, sid meier's civilization, xcom series, and borderlands. in addition, it publishes sports simulation titles comprising nba 2k series, a basketball video game; the wwe 2k professional wrestling series; and pga tour 2k. further, the company offers kerbal space program, olliolli world, and the outer worlds and ancestors: the humankind odyssey under private division; and free-to-play mobile games, such as dragon city, monster legends, two dots, and top eleven. its products are designed for console gaming systems, including playstation 4 and playstation 5; xbox one; the nintendo's switch; personal computers; and mobile comprising smartphones and tablets. the company provides its products through physical retail, digital download, online platforms, and cloud streaming services. take-two interactive software, inc. was incorporated in 1993 and is based in new york, new york.",['Media & Entertainment'],"['Media & Entertainment', 'Consumer Services', 'Software & Services', 'Retailing', 'Technology Hardware & Equipment']",[0.68663454 0.1559424  0.05601107 0.04108061 0.01918263],
TWTR,"twitter, inc. operates as a platform for public self-expression and conversation in real-time. the company's primary product is twitter, a platform that allows users to consume, create, distribute, and discover content. it also provides promoted products that enable advertisers to promote brands, products, and services, as well as enable advertisers to target an audience based on various factors, including who an account follows and actions taken on its platform, such as tweets created and engagement with tweets. its promoted products consist of promoted ads and twitter amplify, follower ads, and twitter takeover. in addition, the company offers monetization products for creators, including tips to directly send small one-time payments on twitter using various payment methods, including bitcoin; super follows, a paid monthly subscription, which includes bonus content, exclusive previews, and perks as a way to support and connect with creators on twitter; and ticketed spaces to support creators on twitter for their time and effort in hosting, speaking, and moderating the public conversation on twitter spaces. further, it offers products for developers and data partners comprising twitter developer platform, a platform that enables developers to build tools for people and businesses using its public application programming interface; and paid access to twitter data for partners with commercial use cases. twitter, inc. was founded in 2006 and is based in san francisco, california.",['Media & Entertainment'],"['Media & Entertainment', 'Pharmaceuticals, Biotechnology & Life Sciences', 'Retailing', 'Telecommunication Services', 'Real Estate']",[0.99134833 0.06867263 0.05384636 0.02691027 0.01257998],
A,"agilent technologies, inc. provides application focused solutions to the life sciences, diagnostics, and applied chemical markets worldwide. the life sciences and applied markets segment offers liquid chromatography systems and components; liquid chromatography mass spectrometry systems; gas chromatography systems and components; gas chromatography mass spectrometry systems; inductively coupled plasma mass spectrometry instruments; atomic absorption instruments; microwave plasma-atomic emission spectrometry instruments; inductively coupled plasma optical emission spectrometry instruments; raman spectroscopy; cell analysis plate based assays; flow cytometer; real-time cell analyzer; cell imaging systems; microplate reader; laboratory software; information management and analytics; laboratory automation and robotic systems; dissolution testing; vacuum pumps, and measurement technologies. the diagnostics and genomics segment provides arrays for dna mutation detection, genotyping, gene copy number determination, identification of gene rearrangements, dna methylation profiling, gene expression profiling, next generation sequencing, target enrichment and genetic data management, and interpretation support software; and produces synthesized oligonucleotide. it also offers immunohistochemistry in situ hybridization, and hematoxylin and eosin staining and special staining; consumables, and software for quality control analysis of nucleic acid samples; and reagents for use in turbidimetry and flow cytometry, as well as develops liquid-based pharmacodiagnostics. the agilent crosslab segment provides gc and lc columns, sample preparation products, custom chemistries, and laboratory instrument supplies; and startup, operational, training, compliance support, software as a service, asset management, and consultation services. the company markets its products through direct sales, distributors, resellers, manufacturer's representatives, and electronic commerce. agilent technologies, inc. was incorporated in 1999 and is headquartered in santa clara, california.","['Pharmaceuticals, Biotechnology & Life Sciences']","['Health Care Equipment & Services', 'Pharmaceuticals, Biotechnology & Life Sciences', 'Technology Hardware & Equipment', 'Semiconductors & Semiconductor Equipment', 'Materials']","[9.83690977e-01 4.49228138e-02 9.08404589e-03 1.19984429e-03
 4.10626162e-05]","['Health Care Equipment & Services', 'Pharmaceuticals, Biotechnology & Life Sciences', 'Technology Hardware & Equipment']"
ABBV,"abbvie inc. discovers, develops, manufactures, and sells pharmaceuticals in the worldwide. the company offers humira, a therapy administered as an injection for autoimmune and intestinal behçet's diseases; skyrizi to treat moderate to severe plaque psoriasis in adults; rinvoq, a jak inhibitor for the treatment of moderate to severe active rheumatoid arthritis in adult patients; imbruvica to treat adult patients with chronic lymphocytic leukemia (cll), small lymphocytic lymphoma (sll), and venclexta, a bcl-2 inhibitor used to treat adults with cll or sll; and mavyret to treat patients with chronic hcv genotype 1-6 infection. it also provides creon, a pancreatic enzyme therapy for exocrine pancreatic insufficiency; synthroid used in the treatment of hypothyroidism; linzess/constella to treat irritable bowel syndrome with constipation and chronic idiopathic constipation; lupron for the palliative treatment of advanced prostate cancer, endometriosis and central precocious puberty, and patients with anemia caused by uterine fibroids; and botox therapeutic. in addition, the company offers orilissa, a nonpeptide small molecule gonadotropin-releasing hormone antagonist for women with moderate to severe endometriosis pain; duopa and duodopa, a levodopa-carbidopa intestinal gel to treat parkinson's disease; lumigan/ganfort, a bimatoprost ophthalmic solution for the reduction of elevated intraocular pressure (iop) in patients with open angle glaucoma (oag) or ocular hypertension; ubrelvy to treat migraine with or without aura in adults; alphagan/ combigan, an alpha-adrenergic receptor agonist for the reduction of iop in patients with oag; and restasis, a calcineurin inhibitor immunosuppressant to increase tear production, as well as other eye care products. abbvie inc. has a research collaboration with dragonfly therapeutics, inc. the company was incorporated in 2012 and is headquartered in north chicago, illinois.","['Pharmaceuticals, Biotechnology & Life Sciences']","['Pharmaceuticals, Biotechnology & Life Sciences', 'Food & Staples Retailing', 'Health Care Equipment & Services', 'Commercial & Professional Services', 'Insurance']","[9.99905586e-01 2.05994249e-04 5.00014321e-05 2.15432920e-06
 4.54478588e-08]","['Pharmaceuticals, Biotechnology & Life Sciences']"
AMGN,"amgen inc. discovers, develops, manufactures, and delivers human therapeutics worldwide. it focuses on inflammation, oncology/hematology, bone health, cardiovascular disease, nephrology, and neuroscience areas. the company's products include enbrel to treat plaque psoriasis, rheumatoid arthritis, and psoriatic arthritis; neulasta that reduces the chance of infection due a low white blood cell count in patients cancer; prolia to treat postmenopausal women with osteoporosis; xgeva for skeletal-related events prevention; otezla for the treatment of adult patients with plaque psoriasis, psoriatic arthritis, and oral ulcers associated with behçet's disease; aranesp to treat a lower-than-normal number of red blood cells and anemia; kyprolis to treat patients with relapsed or refractory multiple myeloma; and repatha, which reduces the risks of myocardial infarction, stroke, and coronary revascularization. it also markets nplate, vectibix, mvasi, parsabiv, epogen, kanjinti, blincyto, aimovig, evenity, amgevitatm, sensipar/mimpara, neupogen, imlygic, corlanor, and avsola. amgen inc. serves healthcare providers, including physicians or their clinics, dialysis centers, hospitals, and pharmacies. it distributes its products through pharmaceutical wholesale distributors, as well as direct-to-consumer channels. it has collaboration agreements with novartis pharma ag; ucb; bayer healthcare llc; beigene, ltd.; eli lilly and company; datos health; and verastem, inc. to evaluate vs-6766 in combination with lumakrastm (sotorasib) in patients with kras g12c-mutant non-small cell lung cancer. it has an agreement with kyowa kirin co., ltd. to jointly develop and commercialize khk4083, a phase 3-ready anti-ox40 fully human monoclonal antibody for the treatment of atopic dermatitis and other autoimmune diseases; and research and development collaboration with neumora therapeutics, inc. and plexium, inc. amgen inc. was incorporated in 1980 and is headquartered in thousand oaks, california.","['Pharmaceuticals, Biotechnology & Life Sciences']","['Pharmaceuticals, Biotechnology & Life Sciences', 'Health Care Equipment & Services', 'Food & Staples Retailing', 'Commercial & Professional Services', 'Insurance']","[9.99906540e-01 1.54423731e-04 2.72123361e-06 5.58108333e-08
 6.06596107e-10]","['Pharmaceuticals, Biotechnology & Life Sciences']"
BIIB,"biogen inc. discovers, develops, manufactures, and delivers therapies for treating neurological and neurodegenerative diseases. the company offers tecfidera, vumerity, avonex, plegridy, tysabri, and fampyra for multiple sclerosis (ms); spinraza for spinal muscular atrophy; and fumaderm to treat plaque psoriasis. it also provides benepali, an etanercept biosimilar referencing enbrel; aduhelm for the treatment of alzheimer's disease; imraldi, an adalimumab biosimilar referencing humira; and flixabi, an infliximab biosimilar referencing remicade. in addition, the company offers rituxan for treating non-hodgkin's lymphoma, chronic lymphocytic leukemia (cll), rheumatoid arthritis, two forms of anca-associated vasculitis, and pemphigus vulgaris; rituxan hycela for non-hodgkin's lymphoma and cll; gazyva to treat cll and follicular lymphoma; and ocrevus for treating relapsing ms and primary progressive ms; and other anti-cd20 therapies. further, it develops biib135, biib061, biib091, and biib107 for ms and neuroimmunology; aducanumab, lecanemab, biib076, and biib080 to treat alzheimer's disease and dementia; biib067, biib078, biib105, biib100, and biib110 to treat neuromuscular disorders; biib124, biib094, biib118, biib101, and biib122 for treating parkinson's disease and movement disorders; biib125 and biib104 for treating neuropsychiatry; dapirolizumab pegol and biib059 to treat immunology related diseases; biib093 and biib131 to treat acute neurology; biib074 for neuropathic pain; and byooviz, biib800, and sb15 biosimilars, which are under various stages of development. the company has collaboration and license agreements with acorda therapeutics, inc.; alkermes pharma ireland limited; denali therapeutics inc.; eisai co., ltd.; genentech, inc.; neurimmune subone ag; ionis pharmaceuticals, inc.; samsung bioepis co., ltd.; sangamo therapeutics, inc.; and sage therapeutics, inc. biogen inc. was founded in 1978 and is headquartered in cambridge, massachusetts.","['Pharmaceuticals, Biotechnology & Life Sciences']","['Pharmaceuticals, Biotechnology & Life Sciences', 'Food & Staples Retailing', 'Health Care Equipment & Services', 'Commercial & Professional Services', 'Technology Hardware & Equipment']","[9.99996662e-01 1.72427990e-05 1.37323673e-06 4.88839582e-08
 2.46547627e-09]","['Pharmaceuticals, Biotechnology & Life Sciences']"
